<?xml version="1.0" encoding="UTF-8"?>
<obrazac_interesovanja xmlns="http://www.rokzasok.rs/gradjanin/iskazivanje-interesovanja"
    xmlns:xsi="http://www.w3.org/2001/XMLSchema-instance"
    xsi:schemaLocation="http://www.rokzasok.rs/gradjanin/iskazivanje-interesovanja iskazivanje_interesovanja.xsd">
    <podaci_o_osobi>
        <drzavljanstvo>Državljanin Republike Srbije</drzavljanstvo>
        <JMBG xmlns="http://www.rokzasok.rs/tipovi">1305999700064</JMBG>
        <ime>Jovan</ime>
        <prezime>Đorđić</prezime>
        <email>jovandjordjic@gmail.com</email>
        <broj_mobilnog_telefona>063551744</broj_mobilnog_telefona>
        <broj_fiksnog_telefona>021777893</broj_fiksnog_telefona>
    </podaci_o_osobi>
    <opsti_podaci>
        <lokacija_opstina>Novi Sad</lokacija_opstina>
        <tip_vakcine>Pfizer-BioNtech</tip_vakcine>
        <davalac_krvi>0</davalac_krvi>
        <datum_podnosenja>2021-11-15</datum_podnosenja>
    </opsti_podaci>
    <dokument_id>12345</dokument_id>
</obrazac_interesovanja>